{
  "schema": "reovim-source-classification/v2",
  "scope": {
    "roots": ["."],
    "exclusions": [
      {
        "prefix": ".git",
        "kind": "vcs_metadata"
      },
      {
        "prefix": "target",
        "kind": "transient_build_output"
      },
      {
        "prefix": "tmp",
        "kind": "working_notes"
      }
    ]
  },
  "rules": [
    {
      "prefix": ".github",
      "precedence": 10,
      "source_owner": {
        "kind": "repository_tooling"
      },
      "source_provenance": "authored",
      "source_use": "tool"
    },
    {
      "prefix": "Documentation",
      "precedence": 10,
      "source_owner": {
        "kind": "repository_tooling"
      },
      "source_provenance": "authored",
      "source_use": "tool"
    },
    {
      "prefix": "changelog",
      "precedence": 10,
      "source_owner": {
        "kind": "repository_tooling"
      },
      "source_provenance": "authored",
      "source_use": "tool"
    },
    {
      "prefix": "lib/depgraph",
      "precedence": 10,
      "source_owner": {
        "kind": "repository_tooling"
      },
      "source_provenance": "authored",
      "source_use": "tool"
    },
    {
      "prefix": "kernel/foundation",
      "precedence": 10,
      "source_owner": {
        "kind": "product",
        "role": "Foundation"
      },
      "source_provenance": "authored",
      "source_use": "production"
    },
    {
      "prefix": "perf",
      "precedence": 10,
      "source_owner": {
        "kind": "repository_tooling"
      },
      "source_provenance": "authored",
      "source_use": "tool"
    },
    {
      "prefix": "product",
      "precedence": 10,
      "source_owner": {
        "kind": "repository_tooling"
      },
      "source_provenance": "authored",
      "source_use": "tool"
    },
    {
      "prefix": "scripts",
      "precedence": 10,
      "source_owner": {
        "kind": "repository_tooling"
      },
      "source_provenance": "authored",
      "source_use": "tool"
    },
    {
      "prefix": "tests/foundation-public-consumer",
      "precedence": 10,
      "source_owner": {
        "kind": "product",
        "role": "Kernel Interface"
      },
      "source_provenance": "authored",
      "source_use": "test"
    },
    {
      "prefix": "tools/conformance",
      "precedence": 10,
      "source_owner": {
        "kind": "repository_tooling"
      },
      "source_provenance": "authored",
      "source_use": "tool"
    },
    {
      "prefix": ".gitignore",
      "precedence": 20,
      "source_owner": {
        "kind": "repository_tooling"
      },
      "source_provenance": "authored",
      "source_use": "tool"
    },
    {
      "prefix": "AGENTS.md",
      "precedence": 20,
      "source_owner": {
        "kind": "repository_tooling"
      },
      "source_provenance": "authored",
      "source_use": "tool"
    },
    {
      "prefix": "CHANGELOG.md",
      "precedence": 20,
      "source_owner": {
        "kind": "repository_tooling"
      },
      "source_provenance": "authored",
      "source_use": "tool"
    },
    {
      "prefix": "CODE_STYLE.md",
      "precedence": 20,
      "source_owner": {
        "kind": "repository_tooling"
      },
      "source_provenance": "authored",
      "source_use": "tool"
    },
    {
      "prefix": "CONTRIBUTING.md",
      "precedence": 20,
      "source_owner": {
        "kind": "repository_tooling"
      },
      "source_provenance": "authored",
      "source_use": "tool"
    },
    {
      "prefix": "Cargo.lock",
      "precedence": 20,
      "source_owner": {
        "kind": "repository_tooling"
      },
      "source_provenance": "generated",
      "source_use": "tool",
      "upstream": {
        "identity": "cargo-manifest-set/v1: sorted relative path, LF, raw manifest bytes, LF",
        "digest": "sha256:f1a39ea5ec5ddae2e7e47c5a10696a3d173507a56627a313bc69c9a58fcea158",
        "digest_subject": {
          "kind": "paths",
          "paths": [
            "Cargo.toml",
            "lib/depgraph/Cargo.toml",
            "tools/conformance/Cargo.toml"
          ]
        }
      }
    },
    {
      "prefix": "Cargo.toml",
      "precedence": 20,
      "source_owner": {
        "kind": "repository_tooling"
      },
      "source_provenance": "authored",
      "source_use": "tool"
    },
    {
      "prefix": "product/Cargo.lock",
      "precedence": 20,
      "source_owner": {
        "kind": "repository_tooling"
      },
      "source_provenance": "generated",
      "source_use": "tool",
      "upstream": {
        "identity": "cargo-manifest-set/v1: sorted relative path, LF, raw manifest bytes, LF",
        "digest": "sha256:e61b483056dd8fd61d3d894c020f5860afca65431a91206bdeebbc30049caa96",
        "digest_subject": {
          "kind": "paths",
          "paths": [
            "kernel/foundation/Cargo.toml",
            "product/Cargo.toml",
            "tests/foundation-public-consumer/Cargo.toml"
          ]
        }
      }
    },
    {
      "prefix": "GOVERNANCE.md",
      "precedence": 20,
      "source_owner": {
        "kind": "repository_tooling"
      },
      "source_provenance": "authored",
      "source_use": "tool"
    },
    {
      "prefix": "LICENSE",
      "precedence": 20,
      "source_owner": {
        "kind": "repository_tooling"
      },
      "source_provenance": "authored",
      "source_use": "tool"
    },
    {
      "prefix": "README.md",
      "precedence": 20,
      "source_owner": {
        "kind": "repository_tooling"
      },
      "source_provenance": "authored",
      "source_use": "tool"
    },
    {
      "prefix": "clippy.toml",
      "precedence": 20,
      "source_owner": {
        "kind": "repository_tooling"
      },
      "source_provenance": "authored",
      "source_use": "tool"
    },
    {
      "prefix": "conformance/dependency-reviews.json",
      "precedence": 20,
      "source_owner": {
        "kind": "repository_tooling"
      },
      "source_provenance": "authored",
      "source_use": "tool"
    },
    {
      "prefix": "conformance/entrypoint-reviews.json",
      "precedence": 20,
      "source_owner": {
        "kind": "repository_tooling"
      },
      "source_provenance": "authored",
      "source_use": "tool"
    },
    {
      "prefix": "conformance/entrypoint-reviews.schema.json",
      "precedence": 20,
      "source_owner": {
        "kind": "repository_tooling"
      },
      "source_provenance": "authored",
      "source_use": "tool"
    },
    {
      "prefix": "conformance/entrypoint-reviews",
      "precedence": 20,
      "source_owner": {
        "kind": "repository_tooling"
      },
      "source_provenance": "authored",
      "source_use": "tool"
    },
    {
      "prefix": "conformance/dependency-reviews.schema.json",
      "precedence": 20,
      "source_owner": {
        "kind": "repository_tooling"
      },
      "source_provenance": "authored",
      "source_use": "tool"
    },
    {
      "prefix": "conformance/dependency-reviews",
      "precedence": 20,
      "source_owner": {
        "kind": "repository_tooling"
      },
      "source_provenance": "authored",
      "source_use": "tool"
    },
    {
      "prefix": "conformance/compat",
      "precedence": 20,
      "source_owner": {
        "kind": "repository_tooling"
      },
      "source_provenance": "authored",
      "source_use": "tool"
    },
    {
      "prefix": "conformance/execution-tool-reviews.json",
      "precedence": 20,
      "source_owner": {
        "kind": "repository_tooling"
      },
      "source_provenance": "authored",
      "source_use": "tool"
    },
    {
      "prefix": "conformance/execution-tool-reviews.schema.json",
      "precedence": 20,
      "source_owner": {
        "kind": "repository_tooling"
      },
      "source_provenance": "authored",
      "source_use": "tool"
    },
    {
      "prefix": "conformance/execution-tool-reviews",
      "precedence": 20,
      "source_owner": {
        "kind": "repository_tooling"
      },
      "source_provenance": "authored",
      "source_use": "tool"
    },
    {
      "prefix": "conformance/product-closures.json",
      "precedence": 20,
      "source_owner": {
        "kind": "repository_tooling"
      },
      "source_provenance": "authored",
      "source_use": "tool"
    },
    {
      "prefix": "conformance/product-closures.schema.json",
      "precedence": 20,
      "source_owner": {
        "kind": "repository_tooling"
      },
      "source_provenance": "authored",
      "source_use": "tool"
    },
    {
      "prefix": "conformance/product-proof-gate.schema.json",
      "precedence": 20,
      "source_owner": {
        "kind": "repository_tooling"
      },
      "source_provenance": "authored",
      "source_use": "tool"
    },
    {
      "prefix": "conformance/source-classification.json",
      "precedence": 20,
      "source_owner": {
        "kind": "repository_tooling"
      },
      "source_provenance": "authored",
      "source_use": "tool"
    },
    {
      "prefix": "conformance/source-classification.schema.json",
      "precedence": 20,
      "source_owner": {
        "kind": "repository_tooling"
      },
      "source_provenance": "authored",
      "source_use": "tool"
    },
    {
      "prefix": "conformance/source-role-map.schema.json",
      "precedence": 20,
      "source_owner": {
        "kind": "repository_tooling"
      },
      "source_provenance": "authored",
      "source_use": "tool"
    },
    {
      "prefix": "conformance/workspace-topology.json",
      "precedence": 20,
      "source_owner": {
        "kind": "repository_tooling"
      },
      "source_provenance": "authored",
      "source_use": "tool"
    },
    {
      "prefix": "conformance/workspace-topology.schema.json",
      "precedence": 20,
      "source_owner": {
        "kind": "repository_tooling"
      },
      "source_provenance": "authored",
      "source_use": "tool"
    },
    {
      "prefix": "rustfmt.toml",
      "precedence": 20,